word,meaning
unfold,"to open or spread out; to reveal information"
ungainliness,"the quality of being awkward or clumsy; ungraceful"
ungrateful,"not feeling or showing gratitude"
unilateral,"done by or affecting only one person or group"
unimportant,"of little or no significance"
unjust,"not based on what is morally right; biased"
unkempt,"having an untidy or disheveled appearance"
unleash,"to release from restraint; to allow force to be felt"
unnerve,"to make someone lose their confidence or strength"
unprecedented,"never done or known before; unique"
unpretentious,"not attempting to impress others with talent"
unravel,"to undo twisted threads; to solve mystery"
unremarkable,"not particularly interesting or surprising"
unresponsive,"not responding or reacting to something"
unrivaled,"better than everyone or everything else; peerless"
unsettled,"lacking order or stability; undecided"
unsympathetic,"not feeling or showing sympathy"
untimely,"happening at an unsuitable time; premature"
unwind,"to undo after being wound; to relax"
unwieldy,"difficult to carry because of its size or shape"
uplifting,"inspiring optimism or hope"
upright,"sitting or standing with back straight; honorable"
uptake,"the action of taking up or making use of something"
urbane,"courteous, debonair, and refined in manner"
usher,"to show or guide someone somewhere"
usurp,"to take a position of power illegally or by force"
utilitarian,"designed to be useful rather than attractive"
utopia,"an imagined place in which everything is perfect"
utter,"complete; absolute; outright"
vacant,"empty; not filled; having no fixtures"
vacillate,"to alternate or waver between different opinions"
vague,"of uncertain, indefinite, or unclear meaning"
vain,"having an excessively high opinion of oneself"
validate,"to check or prove the validity or accuracy of"
validity,"the quality of being logically or factually sound"
vampire,"a corpse supposed to leave its grave at night"
vanish,"to disappear suddenly and completely"
vapid,"offering nothing that is stimulating; dull"
variation,"a change or difference in condition"
varied,"incorporating a number of different types"
venom,"a poisonous substance secreted by animals such as snakes"
venture,"a risky or daring journey; a business project"
verisimilitude,"the appearance of being true or real"
veritable,"used as an intensifier; true; real"
versatile,"able to adapt to many different functions"
vestige,"a trace of something that is disappearing"
veteran,"a person who has had long experience in a particular field"
vex,"to make someone feel annoyed, frustrated, or worried"
viable,"capable of working successfully; feasible"
vibration,"a continuous slight shaking movement"
vicariously,"experienced in the imagination through others"
vicissitude,"a change of circumstances or fortune"
vigilant,"keeping careful watch for possible danger"
vilify,"to speak or write about in an abusive manner"
vindicate,"to clear someone of blame or suspicion"
virile,"having strength, energy, and a strong sex drive"
virtuosity,"great skill in performing or artistic pursuit"
virulent,"extremely severe or harmful in its effects; bitter"
visualize,"to form a mental image of something"
vitality,"the state of being strong and active; passion"
vivacious,"attractively lively and animated; full of spirit"
vocalize,"to utter a sound or word; to express dislike"
vogue,"the prevailing fashion or style at a time"
volition,"the faculty or power of using one's will"
voluble,"talking fluently, readily, or incessantly"
vulgar,"lacking sophistication or good taste; unrefined"
vulnerability,"the state of being exposed to being attacked"
wade,"to walk through water or another liquid with effort"
waive,"to refrain from insisting on or using a right or claim"
wake,"the trail of disturbed water left by a ship"
wakefulness,"the state of being or remaining awake"
wane,"to decrease in power; to diminish"
wanting,"lacking in a required quality; absent"
wanton,"deliberate and unprovoked; a cruel action"
ward,"to guard or protect against danger; a room"
warp,"to become bent or twisted out of shape"
warrant,"to justify or necessitate a course of action"
wary,"feeling or showing caution; aware"
watershed,"an event or period marking a turning point"
wax,"to become larger or more powerful; a substance used for candles"
wayward,"difficult to control or predict; headlong"
weariness,"extreme tiredness; fatigue; being worn out"
weave,"to make up or fabricate; to interlace threads"
weed,"a wild plant growing where not wanted"
welfare,"the health and happiness of a group"
wend,"to go in a specified direction, typically slowly"
wheedle,"to employ endearments or flattery to persuade"
whimsy,"playfully quaint behavior or humor"
whittle,"to reduce or diminish something gradually"
willful,"deliberate; intentional; headstrong"
wilt,"to become limp through heat or loss of water"
wince,"to give a slight involuntary grimace out of pain or distress"
window,"an interval or opportunity for action"
winnow,"to remove people or things from a group"
withdraw,"to remove or take away; to cancel or discontinue"
withhold,"to refuse to give something due; to keep back"
withstand,"to remain undamaged or unaffected by; to resist"
wistful,"having a feeling of vague or regretful longing"
wobble,"to move unsteadily from side to side"
wobbly,"tending to move unsteadily from side to side"
womb,"the organ where offspring are conceived; uterus"
wrest,"to forcibly pull something from someone's grasp"
yen,"a strong desire or propensity; basic Japanese currency"
yield,"to produce or provide; to surrender or submit"
zealous,"having or showing great energy or enthusiasm for a cause or objective"
zenith,"the time at which something is at its most powerful"