word,meaning
ratify,"to sign or give formal consent to a treaty or agreement"
rationale,"a set of reasons or a logical basis for an action"
raucous,"making a disturbingly harsh and loud noise"
raze,"to completely destroy a building or town"
read,"to comprehend written matter; to interpret"
readily,"without hesitation; easily; willingly"
realm,"a kingdom; an area of activity"
rear,"the back part of something; to raise"
rebut,"to prove that a statement or criticism is false"
rebuke,"to express sharp disapproval or criticism of someone"
recant,"to say that one no longer holds an opinion or belief"
recession,"a period of temporary economic decline"
receptive,"willing to consider new suggestions"
reciprocate,"to respond to a gesture or action by making a corresponding one"
reclaim,"to retrieve or recover something previously lost"
recognize,"to identify someone; to acknowledge"
recoil,"to spring back in fear, horror, or disgust"
recollection,"the action or faculty of remembering"
reconcile,"to restore friendly relations; to harmonize"
recount,"to tell someone about something; give an account of an event"
recruit,"to enlist someone in an organization"
redemption,"the action of saving from sin or error"
redolent,"strongly reminiscent or suggestive of something"
redress,"to remedy or set right an unfair situation"
reductive,"presenting a subject in a simplified form"
redundant,"not or no longer needed or useful"
referendum,"a general vote by people on a single question"
refine,"to remove impurities or unwanted elements"
refrain,"to stop oneself from doing something"
refreshing,"serving to reinvigorate someone; novel"
refugee,"a person forced to leave their country"
refute,"to prove a statement or theory to be wrong"
regenerate,"to grow new tissue; to develop or improve an institution"
regime,"a government, especially an authoritarian one"
regrettable,"unwelcome and deserving of condemnation"
regularity,"the state or quality of being constant and frequent"
regulate,"to control the rate or speed of something"
reign,"the period during which a sovereign rules"
reiterate,"to say something again for emphasis"
rejuvenating,"making someone or something look or feel younger or fresher"
relate,"to tell or narrate; to show a connection"
relevant,"closely connected or appropriate to the matter"
relentless,"oppressively constant; incessant; not getting less strong"
relieve,"to cause pain or distress to become less severe"
relish,"great enjoyment; to like something"
relinquish,"to voluntarily cease to keep or claim; to give up"
reluctant,"unwilling and hesitant; disinclined"
remand,"to place a defendant on bail or in custody"
remarkable,"worthy of attention; striking"
remembrance,"the action of remembering an event or person"
reminisce,"to indulge in enjoyable recollection of events"
remiss,"lacking care or attention to duty; negligent"
remnant,"a small remaining quantity of something"
remote,"situated far from centers of population; slight"
remuneration,"money paid for work or a service"
render,"to provide or give a service; to cause to be or become"
renounce,"formally declare one's abandonment of a claim, right, or possession"
renovation,"the action of repairing or improving a building"
renowned,"known or talked about by many people; famous; celebrated"
repeal,"the action of revoking a law; to annul"
repel,"to drive or force back; to disgust"
repellent,"able to repel a particular thing; causing disgust"
repent,"to feel or express sincere regret for wrongdoing"
repertoire,"a stock of pieces that a performer knows"
replenish,"to fill something up again; to restore"
replete,"filled or well-supplied with something"
replicable,"able to be copied or reproduced exactly"
repose,"a state of rest, sleep, or tranquility; feeling calm"
reprehensible,"deserving censure or criticism"
represent,"to stand for or symbolize something"
reprimand,"a formal expression of disapproval; reproach"
reprise,"a repetition of a performance or a repeated passage in music"
reproach,"to express disapproval or disappointment"
reproduce,"to produce a copy of something"
reproducible,"able to be reproduced or copied exactly"
repression,"subduing someone by force; limiting freedom"
repudiate,"to refuse to accept or be associated with; to reject"
repulse,"to drive back an attack by force; to reject"
reputed,"according to general belief but not necessarily true"
requisite,"made necessary by particular circumstances"
resentment,"bitter indignation at having been treated unfairly"
reservation,"a doubt or prearrangement; the action of reserving"
reserve,"refrain from using; lack of openness in manner"
resemble,"to look like or be similar to another person"
resignation,"act of giving up a position; accepting unpleasantness"
resilient,"able to recover quickly; adaptable"
resistant,"offering resistance to something; unaffected"
resolve,"to find a solution to a problem or settle a dispute"
resort,"to turn to for help; a vacation destination"
respite,"a short period of rest from something difficult"
respectively,"separately or individually and in the order mentioned"
restless,"unable to rest or relax as a result of anxiety"
restorative,"having the ability to restore health"
restrain,"to prevent from doing something; to keep under control"
restrictive,"imposing restrictions on someone's activities"
resurrection,"restoration or revival of something; coming back"
retaliate,"to make an attack or assault in return for a similar attack"
retention,"the continued possession or control of something"
reticent,"not revealing one's thoughts readily; unwilling to talk"
retort,"to say something in answer in a sharp manner"
retract,"to draw back in; to disavow or withdraw"
retrace,"to go back over the same route that one has just taken"
retreat,"to withdraw from a position; a secluded place"
retribution,"punishment inflicted as vengeance"
retrieve,"to get or bring something back; to regain possession of"
retrospect,"a survey or review of a past course of events"
retrospective,"looking back on or dealing with past events"
revamp,"to give new and improved form; to renovate"
reverberate,"to be repeated as an echo; to have long effect"
reverence,"deep respect for someone or something"
reverie,"a state of being pleasantly lost in one's thoughts"
reverse,"to move backward; the opposite of something"
revert,"to return to a previous state or condition"
revitalization,"the process of making something active or healthy again"
revocation,"the official cancellation of a decree or promise"
revoke,"to put an end to the validity of a decree"
revolt,"to rise in rebellion; to refuse allegiance"
revolve,"to move in a circle on a central point or axis"
rhetoric,"the art of effective or persuasive speaking"
ricochet,"to rebound one or more times off a surface"
rife,"of common occurrence; widespread and bad"
rift,"a crack or break; a serious disagreement"
rigidity,"the inability to be bent; inflexibility"
rigorous,"extremely thorough and careful; strict"
ripple,"a small wave on the surface of water"
roam,"to move about aimlessly; to wander"
robust,"strong and healthy; vigorous; strong"
rotunda,"a round building or room, especially one with a dome"
rotate,"to move in a circle around an axis"
rounding,"making a number less exact but more convenient to use"
rowdy,"noisy and likely to cause trouble; disorderly"
rudimentary,"involving or limited to basic principles; not fully developed"
rue,"to bitterly regret something one has done"
rugged,"having a broken, rocky surface; tough"
rumble,"to make a continuous deep, resonant sound"
rummage,"to search unsystematically through a mass"
runoff,"the draining away of water from the surface of an area of land"
rustic,"relating to the countryside; simple"
sacred,"connected with God; deserving veneration"
saga,"a long story of heroic achievement or adventures"
sage,"a wise person; an aromatic plant"
salient,"most noticeable or important; prominent"
saliva,"watery liquid produced in the mouth"
salvation,"deliverance from sin and its consequences"
sanction,"official permission or approval; a penalty"
sanctuary,"a place of refuge or safety; protection"
sanity,"the state of being sane; soundness of mind"
sap,"to gradually weaken or destroy someone's strength"
sarcastic,"using irony to mock or convey contempt"
satiety,"the feeling or state of being completely full"
satirical,"containing or using satire to criticize or mock"
saturated,"holding as much of a substance as can be absorbed; soaked"
savage,"fierce, violent, and uncontrolled; cruel"
savant,"a learned person, especially a distinguished scientist"
savvy,"perceptive and shrewd; practical knowledge"
saw,"a hand tool with sharp points for cutting"
scandalous,"causing public outrage by perceived offense"
scarce,"insufficient for the demand; rare"
scavenge,"to search for and collect usable waste"
scenario,"a written outline of a movie or novel; situation"
scoff,"to speak to someone in a scornfully derisive way"
scion,"a descendant of a wealthy or famous family"
scornful,"feeling or expressing contempt; mocking"
scour,"to clean hard by rubbing; to search thoroughly"
scout,"a person sent to gather information; youth"
scowling,"frowning in an angry or bad-tempered way"
scribble,"to write or draw something untidily or carelessly"
scruffy,"shabby and untidy or dirty"
scurry,"to move hurriedly with short quick steps"
seal,"an official mark; to join things together"
seamless,"smooth and continuous, with no apparent gaps"
seclude,"to keep someone away from other people"
seclusion,"the state of being private; a retreat"
secrete,"to produce and discharge a substance from a cell or gland"
sedating,"calming or tranquilizing; making sleepy"
sedentary,"staying and sitting down; somewhat inactive"
sediment,"matter that settles to the bottom of liquid"
self-conscious,"feeling undue awareness of oneself; embarrassed"
self-defeating,"preventing the intended result from happening"
self-effacing,"not claiming attention for oneself; modest"
self-evident,"not needing to be demonstrated; obvious"
self-serving,"having concern for one's own interests first"
senile,"showing the weaknesses of old age"
sentiment,"a view of or attitude toward a situation; opinion"
serenity,"the quality of being calm and peaceful"
servile,"having an excessive willingness to please others"
set,"to put or stand something; to begin a job"
setback,"a reversal or check in progress; problem"
sewer,"an underground conduit for carrying off drainage water"
shabby,"in poor condition through long use; untidy"
shadow,"a dark area produced by light being blocked"
shaggy,"having long, thick, and unkempt hair or fur"
sham,"a thing that is not what it claims to be"
shed,"to discard; to cast off; to provide info"
sheer,"nothing but; absolute; very steep"
shield,"a broad piece of metal for protection"
shore,"the land along the edge of a sea; to support something weak"
showy,"having a grand or impressive appearance"
shroud,"a length of cloth in which a dead person is wrapped for burial; to hide"
shun,"to persistently avoid or ignore someone"
shuffle,"to walk by dragging one's feet along the ground"
significant,"sufficiently great or important to be worthy"
signify,"to be a sign of; to mean or indicate"
simultaneous,"occurring, operating, or done at the same time"
simulation,"imitation of a situation or process"
simulate,"to imitate the character of something"
sin,"an immoral act considered a transgression against law"
sincerity,"the quality of being honest and free from deceit"
single,"only one; to choose something from a group"
singular,"extraordinary; exceptional; referring to just one"
sinister,"giving an impression of being harmful or evil"
skeptical,"not easily convinced; having doubts"
sketchy,"not thorough or detailed; hasty"
skirmish,"an episode of irregular fighting; argument"
skirt,"a garment; to go around the edge of something"
skyrocket,"to rise abruptly and very rapidly"
slant,"slope or lean; a particular point of view"
slovenly,"untidy and dirty; disorganized"
slow,"moving or operating at a low speed"
sluggish,"slow-moving or inactive; lacking energy"
slumber,"to sleep; a state of dormancy"
smash,"to violently break something into pieces; a great success"
smirk,"a self-satisfied or silly smile"
smother,"to kill by covering the nose; to stifle or suppress"
sneer,"a contemptuous or mocking smile or remark"
snobbish,"characteristic of a snob; haughty"
sober,"not affected by alcohol; sensible; calm; serious"
solace,"comfort in a time of distress or sadness"
solemn,"very serious and sincere; formal and dignified"
solicit,"to ask for or try to obtain something from someone"
solidarity,"unity or agreement of feeling or action in a group"
solitary,"done or existing alone; without other people"
soluble,"able to be dissolved, especially in a liquid"
somber,"dark or dull in color; melancholy; gloomy"
sophisticated,"having a great deal of worldly experience; complicated"
sophistry,"the use of fallacious arguments with intent to deceive"
sordid,"involving ignoble actions; dirty or unpleasant"
sore,"painful or aching; a cause of distress"
sort,"to arrange things in categories; a type"
sound,"healthy; reliable; reasonable; valid"
spacious,"having ample space; capacious"
span,"the full extent of something; range or duration"
spawn,"to produce or generate; to bring about"
speciation,"the formation of new and distinct species in evolution"
species,"a group of living organisms consisting of individuals"
specious,"superficially plausible, but actually wrong"
specimen,"an individual animal or plant used as an example"
spectator,"a person who watches at a show or game"
speculate,"to form a theory or conjecture about a subject without firm evidence"
spew,"to expel large quantities of something rapidly"
spike,"a thin, pointed piece of metal; a sudden increase"
spin,"to turn around quickly; to weave or tell a story"
spiteful,"showing or caused by malice; unkind"
spleen,"an abdominal organ involved in the production of blood cells"
splendid,"very impressive; very good; excellent"
splotch,"a daub, blot, or smear of something like paint or ink"
spontaneous,"occurring as a result of sudden inner impulse"
sporadic,"occurring at irregular intervals; scattered"
sprawl,"to spread out in an ungainly way; spread of buildings"
sprint,"to run very fast for a short distance"
spur,"an inducement; to urge forward"
spurious,"not being what it purports to be; false or fake"
stagger,"to walk unsteadily; to startle someone"
stagnant,"having no current or flow; not advancing"
stain,"to mark or discolor with something not easily removed"
stamina,"the ability to sustain prolonged effort; tenacity"
stampede,"a sudden panicked rush of a number of animals"
stand,"an attitude or opinion; maintained position"
stanza,"a group of lines forming a unit in a poem"
staple,"a main or important part of something"
stark,"severe or bare in appearance; stiff or rigid"
startle,"to cause a person to feel sudden shock or alarm"
static,"lacking in movement or change; stationary"
stature,"importance gained by achievement; height"
staunch,"loyal and committed in attitude or support"
stay,"to remain in a specified state or place"
steeped,"soaked in water; filled with a quality"
stem,"the main body of a plant; an upright timber of a ship"
stereotyped,"a fixed idea about a person or thing"
sterile,"not able to produce children; unproductive"
stern,"serious and unrelenting; showing disapproval"
stigmatize,"to describe or regard as worthy of disgrace"
stimulate,"to raise levels of physiological or nervous activity"
sting,"a small pointed organ in insects; to hurt"
stipulate,"to demand or specify a requirement"
stir,"to move a substance around to mix it; to arouse"
stitch,"a loop of thread used to join points or repair fabric"
stoke,"to encourage or incite; to add fuel to a fire"
straddle,"to sit or stand with one leg on either side"
straightforward,"uncomplicated and easy to do; honest; direct"
strain,"to force a part of one's body to make a strenuous effort"
strenuous,"requiring or using great exertion; arduous; tough"
strident,"loud and harsh; grating and unpleasant"
strife,"angry or bitter disagreement; conflict"
striking,"attracting attention by being unusual or extreme"
stringent,"strict, precise, and exacting regulations"
stroke,"a gentle touch or movement; a sudden attack"
stubborn,"having dogged determination; difficult to remove"
studious,"spending a lot of time studying or reading"
stupefy,"to make someone unable to think properly"
stupor,"a state of near-unconsciousness; unable to think"
sturdy,"strongly and solidly built"
stunted,"prevented from growing or developing properly"
stylus,"a hard point used for writing or following a groove"
stymie,"to prevent or hinder the progress of"
subduct,"of a tectonic plate moving sideways and downward into the mantle"
subjugate,"to bring under domination or control; to conquer"
submerge,"to cause to be under water; to hide"
submit,"to yield to a superior force; to contend or assert"
subsequent,"coming after something in time; following"
subservient,"prepared to obey others unquestioningly; less important"
subsist,"to maintain or support oneself at a minimal level"
substantially,"to a great or significant extent; in most details"
substantiate,"to provide evidence to support the truth of"
substitute,"a person or thing serving in place of another"
subsume,"to include or absorb something in something else"
subterranean,"existing, occurring, or done under the earth's surface"
subtle,"delicate or precise as to be difficult to describe"
subterfuge,"deceit used in order to achieve one's goal"
subversive,"seeking to undermine an established system"
subscription,"the action of making an advance payment to receive something regularly"
succinct,"written or spoken briefly and clearly"
succumb,"to fail to resist pressure, temptation, or a negative force"
succulent,"of food tender, juicy, and tasty"
sue,"to institute legal proceedings against someone"
suffrage,"the right to vote in political elections"
suitor,"a man who pursues a relationship with a view to marriage"
sullen,"bad-tempered and sulky; gloomy"
sumptuous,"splendid and expensive-looking"
superficial,"lacking depth of character or understanding"
superfluous,"extra; exceeding what is sufficient; unnecessary"
supernova,"a star that explodes and becomes much brighter for a short time"
superstition,"unfounded belief in supernatural beings"
supervise,"to observe and direct the execution of a task"
supplemental,"provided in addition to what is already present"
suppleness,"the quality of being flexible or bending easily"
supplication,"the action of asking for something earnestly"
supremacy,"the state of being superior to all others"
surfeit,"an excessive amount of something"
surmise,"to suppose that something is true without evidence"
surmount,"to overcome a difficulty or obstacle"
surpass,"to be greater than; to exceed"
surreal,"having the qualities of a dream; bizarre; uncanny"
surreptitious,"kept secret because it would not be approved"
surge,"a sudden powerful forward movement"
susceptible,"likely or liable to be influenced, harmed, or affected by a particular thing"
suspenseful,"arousing excitement or worry about what happens"
suspicious,"having a cautious distrust; questionable"
sustenance,"food and drink as a source of strength"
swab,"an absorbent pad for cleaning wounds; a specimen"
sway,"to move slowly back and forth; to influence"
symbiosis,"interaction between two different organisms"
symptomatic,"serving as a symptom or sign of something"
synchronize,"to cause to occur or operate at the same time or rate"
syntax,"the arrangement of words and phrases to create well-formed sentences"
tablet,"a small disc of medicine; a writing pad; a computer"
tacit,"understood or implied without being stated"
tactful,"having or showing sensitivity in dealing with others"
tackle,"to make determined efforts to deal with a problem"
taint,"a trace of a bad quality or substance"
take,"to lay hold of something; to understand"
tale-bearer,"a person who spreads gossip or secrets"
tally,"a current score or amount of something"
tamper,"to interfere with something in order to damage"
tangible,"perceptible by touch; real"
tantalize,"to torment or tease with the sight of something"
tantamount,"equivalent in seriousness to; virtually the same"
tau,"Greek letter; used in physics and math"
taut,"stretched or pulled tight; not slack"
tax,"a compulsory contribution; a burdensome effort"
taxonomy,"the branch of science concerned with classification"
tease,"to provoke playfully; to find out information"
tectonic,"relating to the structure of the earth's crust"
tedious,"too long, slow, or dull; tiresome"
telegenic,"having an appearance or manner that is appealing on television"
temper,"to make less severe by adding something; state of mind"
temperament,"a person's nature or character"
tempest,"a violent windy storm"
tempo,"the speed at which music is played"
tenable,"able to be maintained or defended against attack"
tenacious,"tending to keep a firm hold; not giving up"
tenant,"a person who occupies land or property from a landlord"
tend,"to care for; to regularly behave in a way"
tender,"gentle and kind; considerate; compassionate"
tentative,"not certain or fixed; provisional"
tenuous,"very weak or slight; hardly existing"
tenure,"the holding of an office; guaranteed permanent employment"
terminate,"to bring something to an end; to stop"
terrain,"a stretch of land with regard to its physical features"
terrestrial,"relating to the earth or its inhabitants"
territorial,"relating to ownership of an area of land"
terse,"sparing in the use of words; abrupt; short"
testament,"something that serves as proof; a will"
testimony,"a formal written statement in court; testament"
therapy,"treatment intended to relieve or heal"
threshold,"the point at which something starts to happen"
thrill,"a sudden feeling of excitement and pleasure"
thrifty,"using money and resources carefully; frugal"
throng,"a large, densely packed crowd of people"
thrive,"to grow or develop well or vigorously; to flourish"
thwart,"to prevent someone from accomplishing something; to frustrate"
tilt,"to move into a sloping position; to incline"
timid,"showing a lack of courage or confidence; shy"
timorous,"showing nervousness or a lack of confidence"
tinge,"to color slightly; a slight feeling or quality"
tip,"a small amount of money given for service; a pointed end"
titular,"holding a purely formal title without real authority"
toil,"work extremely hard or incessantly for a long time"
tolerant,"showing willingness to allow other opinions"
toll,"a charge for use; a cost in terms of life"
topography,"the arrangement of natural physical features"
torpor,"a state of physical or mental inactivity; being active and having no energy"
tortuous,"full of twists and turns; not simple"
toss,"to throw something lightly or carelessly"
touchstone,"a standard by which something is judged"
touchy,"easily upset or offended; oversensitive"
toxicity,"the quality of being toxic or poisonous"
trade,"the action of buying and selling; a compromise"
trajectory,"the path followed by a projectile; course"
trample,"to tread on and crush; to treat with contempt"
tranquil,"free from disturbance; calm and peaceful"
transaction,"an instance of buying or selling; business deal"
transcend,"to be or go beyond the range or limits of something"
transgenic,"containing genetic material from another organism"
transient,"lasting only for a short time; impermanence"
transitional,"relating to or characteristic of a process of change"
transparent,"allowing light to pass through; easy to understand"
transplant,"to move or transfer to another place"
transpire,"to occur or happen; to be revealed"
transport,"to overwhelm someone with a strong emotion, especially joy"
traverse,"to travel across or through something"
treacherous,"guilty of betrayal; dangerous"
tremulous,"shaking or quivering, usually from nervousness"
trendy,"very fashionable or up to date"
tributary,"a river or stream flowing into a larger one"
tribute,"an act or gift intended to show gratitude"
trickle,"to flow in a small stream; flowing slowly"
tricky,"requiring care and skill; difficult; crafty"
trigger,"to cause something to happen; a release mechanism"
trim,"to make something neat by cutting away parts"
triumph,"a great victory or achievement; to win"
trivial,"of little value or importance; not serious"
trope,"a figurative use of a word; a recurring theme"
trophic,"relating to feeding and nutrition"
turbulent,"characterized by conflict, disorder, or confusion; changing direction"
turnout,"the number of people attending an event or voting"
ubiquitous,"present, appearing, or found everywhere"
ultimate,"being the end of a process; fundamental"
umpire,"an official who watches a game to enforce the rules and settle disputes"
unanimity,"agreement by all people involved; consensus"
unbearable,"not able to be endured or tolerated; very annoying"
uncharacteristic,"not typical of a particular person or thing"
unchecked,"not examined or verified; not restrained"
unconditional,"not subject to any conditions; absolute"
unconscionable,"not right or reasonable; excessive"
uncouth,"lacking good manners, refinement, or grace"
underappreciat,"fail to value something highly enough"
underestimate,"to estimate something as being smaller than actual"
underlying,"lying or situated under; fundamental"
underline,"to draw a line under; to emphasize"
underpin,"to support from below; to fortify or promote"
underscore,"to draw a line under a word; to emphasize"
underway,"having started and currently in progress"
underwrite,"to accept liability under an insurance policy"
undulate,"to move with a smooth up-and-down motion"
unearth,"to find something in the ground by digging"
uneven,"not level or smooth; not following a regular pattern"
uneventful,"not marked by interesting or exciting events"
